Program Facility Name_x,Locality_x,County_x,Contributing Factor_x,Source_x,Material Name_x,Material Family_x,Year_x,Unrecovered Amount_x,Program Facility Name_y
CON EDISON FEEDER LINE LEAK,BRONX,Kings,Equipment Failure,Transformer,dielectric fluid,Petroleum,2015.0,240.0,CON EDISON FEEDER LINE LEAK
CON EDISON FEEDER LINE LEAK/HELL GATE,BRONX,Bronx,Unknown,Unknown,dielectric fluid,Petroleum,2017.0,800.0,CON EDISON FEEDER LINE LEAK/HELL GATE
CON EDISON FEEDER LINE M51 LEAK,MANHATTAN,New York,Equipment Failure,Commercial/Industrial,dielectric fluid,Petroleum,2013.0,700.0,CON EDISON FEEDER LINE M51 LEAK
CON EDISON FEEDER LINE M51 WEST 49 SUB,MANHATTAN,New York,Unknown,Commercial/Industrial,dielectric fluid,Petroleum,2014.0,290.0,CON EDISON FEEDER LINE M51 WEST 49 SUB
CON EDISON FEEDER LINE- FARRAGUT SUBSTATION,MANHATTAN,New York,Equipment Failure,Transformer,dielectric fluid,Petroleum,2016.0,190.0,CON EDISON FEEDER LINE- FARRAGUT SUBSTATION
CON EDISON FEEDER M-52,YONKERS,New York,Equipment Failure,Commercial/Industrial,transformer oil,Petroleum,2019.0,1036.0,CON EDISON FEEDER M-52
CON EDISON FEEDER Y50,NEW ROCHELLE,Westchester,Unknown,Commercial/Industrial,dielectric fluid,Petroleum,2020.0,1175.0,CON EDISON FEEDER Y50
CON EDISON FEEDER,MANHATTAN,New York,Unknown,Commercial/Industrial,dielectric fluid,Petroleum,2011.0,710.0,CON EDISON FEEDER
CON EDISON FREON RELEASE AT METER SHOP,QUEENS,Queens,Equipment Failure,Commercial/Industrial,freon,Other,2014.0,120.0,CON EDISON FREON RELEASE AT METER SHOP
CON EDISON GOETHELS SUB STATION,STATEN ISLAND,Richmond,Unknown,Commercial/Industrial,dielectric fluid,Petroleum,2017.0,1000.0,CON EDISON GOETHELS SUB STATION
CON EDISON JAMAICA SUBSTATION SPILL TO SOIL,QUEENS,Queens,Equipment Failure,Commercial/Industrial,transformer oil,Petroleum,2013.0,500.0,CON EDISON JAMAICA SUBSTATION SPILL TO SOIL
CON EDISON M14 FEEDER LEAK,MANHATTAN,New York,Unknown,Commercial/Industrial,dielectric fluid,Petroleum,2011.0,899.0,CON EDISON M14 FEEDER LEAK
CON EDISON M52 FEEDER LEAK,MANHATTAN,New York,Unknown,Commercial/Industrial,dielectric fluid,Petroleum,2014.0,2100.0,CON EDISON M52 FEEDER LEAK
CON EDISON M52 FEEDER LEAK,MANHATTAN,New York,Unknown,Commercial/Industrial,dielectric fluid,Petroleum,2011.0,440.0,CON EDISON M52 FEEDER LEAK
CON EDISON PROPERTY,QUEENS,Queens,Equipment Failure,Commercial/Industrial,dielectric fluid,Petroleum,2024.0,400.0,CON EDISON PROPERTY
CON EDISON TRANFORMER VAULT #0469,BROOKLYN,Kings,Equipment Failure,Commercial/Industrial,dielectric fluid,Petroleum,2012.0,163.0,CON EDISON TRANFORMER VAULT #0469
CON EDISON TRANSFORMER FIRE,MANHATTAN,New York,Equipment Failure,Transformer,dielectric fluid,Petroleum,2013.0,300.0,CON EDISON TRANSFORMER FIRE
CON EDISON TRANSFORMER MANHOLE #2010,BROOKLYN,Kings,Equipment Failure,Commercial/Industrial,dielectric fluid,Petroleum,2014.0,100.0,CON EDISON TRANSFORMER MANHOLE #2010
CON EDISON TRANSMISSION FEEDER,QUEENS,Queens,Equipment Failure,Commercial/Industrial,dielectric fluid,Petroleum,2013.0,219.0,CON EDISON TRANSMISSION FEEDER
CON EDISON TRANSMISSION FEEDER,MANHATTAN,New York,Equipment Failure,Commercial/Industrial,dielectric fluid,Petroleum,2010.0,150.0,CON EDISON TRANSMISSION FEEDER
CON EDISON,BRONX,Bronx,Equipment Failure,Commercial/Industrial,dielectric fluid,Petroleum,2022.0,500.0,CON EDISON
CON EDISON,MANHATTAN,New York,Unknown,Commercial/Industrial,dielectric fluid,Petroleum,2009.0,200.0,CON EDISON
CON EDISON,MANHATTAN,New York,Equipment Failure,Unknown,transformer oil,Petroleum,2020.0,770.0,CON EDISON
DIELECTRIC SPILL AT CON EDISON MANHOLE,BROOKLYN,Kings,Equipment Failure,Commercial/Industrial,dielectric fluid,Petroleum,2012.0,1900.0,DIELECTRIC SPILL AT CON EDISON MANHOLE
FEEDER - MANHOLE # 62576 - CON ED,MANHATTAN,New York,Unknown,Transformer,dielectric fluid,Petroleum,2017.0,2000.0,FEEDER - MANHOLE # 62576 - CON ED
FEEDER LEAK CON ED,BROOKLYN,Kings,Equipment Failure,Commercial/Industrial,dielectric fluid,Petroleum,2018.0,975.0,FEEDER LEAK CON ED
FEEDER LINE/CON ED,Other,Bronx,Unknown,Commercial/Industrial,dielectric fluid,Petroleum,2014.0,1300.0,FEEDER LINE/CON ED
HTV 1885 (ON MTA PROPERTY - NOT CON ED),BROOKLYN,Kings,Equipment Failure,Commercial/Industrial,dielectric fluid,Petroleum,2018.0,300.0,HTV 1885 (ON MTA PROPERTY - NOT CON ED)
MAN HOLE - FEEDER - CON ED,MANHATTAN,New York,Equipment Failure,Commercial/Industrial,dielectric fluid,Petroleum,2016.0,695.0,MAN HOLE - FEEDER - CON ED
MANHOLE - CON ED,MANHATTAN,New York,Equipment Failure,Unknown,dielectric fluid,Petroleum,2009.0,300.0,MANHOLE - CON ED
MANHOLE 61527 CON ED,MANHATTAN,New York,Equipment Failure,Commercial/Industrial,dielectric fluid,Petroleum,2018.0,300.0,MANHOLE 61527 CON ED
MANHOLE 62631 CON ED,MANHATTAN,New York,Unknown,Commercial/Industrial,dielectric fluid,Petroleum,2021.0,374.0,MANHOLE 62631 CON ED
STRUCTURE # VS2060 CON ED,BRONX,Bronx,Equipment Failure,Transformer,dielectric fluid,Petroleum,2019.0,300.0,STRUCTURE # VS2060 CON ED
TIBBETTS BROOK CON ED M-51 LEAK,YONKERS,Westchester,Equipment Failure,Commercial/Industrial,dielectric fluid,Petroleum,2018.0,376.0,TIBBETTS BROOK CON ED M-51 LEAK
TX VAULT CON ED,MANHATTAN,New York,Equipment Failure,Transformer,dielectric fluid,Petroleum,2015.0,500.0,TX VAULT CON ED
